{
  "$schema": "schemas/contract-manifest.schema.json",
  "active_beachhead_profile": null,
  "advisory_documents": [
    {
      "id": "MDOS-V7-README",
      "path": "docs/market_demand_os_v7_2/README.md",
      "sha256": "cc12e85573813dbf18171d9b3b4ef249302a7be2cfce7060085eb1b8e29f16ff",
      "version": "1.3.0"
    }
  ],
  "contract_id": "AK-MDOS-V7",
  "defaults_pending_ratification": {
    "contact_enabled": false,
    "external_reads_enabled": false,
    "external_writers_enabled": false,
    "pc10_enabled": false,
    "spend_enabled": false
  },
  "evidence_artifacts": [
    {
      "id": "MDOS-V7.1-BASELINE-IMPLEMENTATION-TRACE",
      "path": "docs/market_demand_os_v7_2/evidence/baseline-implementation-trace-overlay.v7.1.json",
      "sha256": "e9ee33c957888c251eb7ee0c7e6cc0fc3792a8ca3ceb779ddbd23d91c3fddd55",
      "version": "1.0.0"
    },
    {
      "id": "MDOS-V7.2-OPERATOR-TELEPHONY-OFFLINE-EVIDENCE",
      "path": "docs/market_demand_os_v7_2/evidence/operator-telephony-offline-evidence.json",
      "sha256": "127429336ba475f7268108dce2934fbbd653f57bd9c91331ff0cc692be5bd791",
      "version": "1.0.0"
    },
    {
      "id": "MDOS-V7.2-RATIFICATION-READINESS",
      "path": "docs/market_demand_os_v7_2/evidence/ratification-readiness.json",
      "sha256": "625a1a5c79b7921687dc797422cf53e10ea0227d7cf6dea807845d267ddff428",
      "version": "1.1.0"
    }
  ],
  "fixed_at": "2026-09-02",
  "live_gates": {
    "bitrix": false,
    "mail": false,
    "mango": false,
    "tenderplan": false,
    "unisender": false
  },
  "normative_documents": [
    {
      "id": "MDOS-V7-ROOT",
      "path": "docs/market_demand_os_v7_2/CONTRACT.md",
      "sha256": "4d7ace26ee108a1862ace3c9659c389e62111032c2673e915639d691a8468fe7",
      "version": "1.3.0"
    },
    {
      "id": "APP-MDOS-COMMERCIAL-MODEL",
      "path": "docs/market_demand_os_v7_2/APP-MDOS-COMMERCIAL-MODEL.md",
      "sha256": "6ee294eeef127a5a0d74863c2f472ccbe2e3d992ea3606394ffa08032f632c33",
      "version": "1.1.0"
    },
    {
      "id": "APP-MDOS-REFERENCE-ARCHITECTURE",
      "path": "docs/market_demand_os_v7_2/APP-MDOS-REFERENCE-ARCHITECTURE.md",
      "sha256": "3d54da33d5e5ad2a32df48fe0bee86b4164d3563202f90602c2782315fa905fc",
      "version": "1.2.0"
    },
    {
      "id": "APP-MDOS-DEMAND-INTELLIGENCE",
      "path": "docs/market_demand_os_v7_2/APP-MDOS-DEMAND-INTELLIGENCE.md",
      "sha256": "469551d0ae4b19d3819c630e228a1c5d4cb16b411d9eb2afd53dbc457fcb5dbe",
      "version": "1.0.0"
    },
    {
      "id": "APP-MDOS-SOURCE-PORTFOLIO",
      "path": "docs/market_demand_os_v7_2/APP-MDOS-SOURCE-PORTFOLIO.md",
      "sha256": "65f6346f39bd8b479d234bc4cb814c35512819f0e880ddf3d63e11186f951481",
      "version": "1.2.0"
    },
    {
      "id": "APP-MDOS-DECISION-OUTCOMES",
      "path": "docs/market_demand_os_v7_2/APP-MDOS-DECISION-OUTCOMES.md",
      "sha256": "6d1aa42a9f4de80a0efd21f4e6509865e69987cab9ac87742de20e79c57b1dc5",
      "version": "1.1.0"
    },
    {
      "id": "APP-MDOS-DELIVERY-ASSURANCE",
      "path": "docs/market_demand_os_v7_2/APP-MDOS-DELIVERY-ASSURANCE.md",
      "sha256": "d4d73c061097b98ef9e04a1c2488901af0e2f90d8e8cab112375d6062d36f911",
      "version": "1.2.0"
    },
    {
      "id": "APP-MDOS-OPERATOR-TELEPHONY",
      "path": "docs/market_demand_os_v7_2/APP-MDOS-OPERATOR-TELEPHONY.md",
      "sha256": "de85d26d37df8760d521854f727c5371dfd432d96314bb8e031c531df454b834",
      "version": "1.1.0"
    },
    {
      "id": "APP-MDOS-MAIL-BITRIX-OBSERVER",
      "path": "docs/market_demand_os_v7_2/APP-MDOS-MAIL-BITRIX-OBSERVER.md",
      "sha256": "5bc92db1eb0ab366b095eb4d6c7933ada5052c387a2effef28bfa7f68bd0a4c2",
      "version": "1.0.0"
    }
  ],
  "package_digest_algorithm": "sha256(canonical-json(sorted(path,sha256)))",
  "package_root_sha256": "f5d05e55656add49222f3539ff2afbde178c211227853da7709d322a07542bfa",
  "package_version": "7.2.0-rc.2",
  "proposed_beachhead_profile": {
    "fulfilment_model_id": "FACTORY_DELIVERY_NO_INSTALLATION",
    "id": "PROPOSED-BEACHHEAD-AL-WINDOWS-RU-MOS-DELIVERY",
    "installation_scope": "EXCLUDED",
    "motion_id": "EXISTING_ACCOUNT_EXPANSION",
    "product_scope_id": "ALUMINIUM_WINDOWS",
    "region_code": "RU-MOS",
    "source_ref": "docs/market_demand_os_v7_2/evidence/ratification-readiness.json",
    "status": "PROPOSED_NOT_ACTIVE"
  },
  "ratification": null,
  "registries": [
    {
      "id": "MDOS-V7-REQUIREMENTS",
      "path": "docs/market_demand_os_v7_2/registries/requirements-registry.json",
      "sha256": "229f1454ee951887a8fcb81d2ff02465dc443f620db41eb99637f47190d430c0",
      "version": "1.2.0"
    },
    {
      "id": "MDOS-V7-ACCEPTANCE",
      "path": "docs/market_demand_os_v7_2/registries/acceptance-manifest.json",
      "sha256": "934a1fe2b3276b0e09f3c2224e6057e63d58f2903e8e96c9839a98ec5705a419",
      "version": "1.2.0"
    },
    {
      "id": "MDOS-V7-TRACEABILITY",
      "path": "docs/market_demand_os_v7_2/registries/traceability-registry.json",
      "sha256": "e780a081d50a87d0a444a0a3098d9d15366bedd6c63d88758997da03c606ddae",
      "version": "1.2.0"
    }
  ],
  "required_approver_roles": [
    "BusinessOwner",
    "ContractAuthority",
    "PrivacyLegalOwner",
    "IndependentEvidenceVerifier"
  ],
  "schema_version": "1.2.0",
  "schemas": [
    {
      "id": "SCHEMA-ACCEPTANCE-MANIFEST",
      "path": "docs/market_demand_os_v7_2/schemas/acceptance-manifest.schema.json",
      "sha256": "8509f1abb82fddb3044f47118ed344ef90605e5e2514566c0c49581502984c98",
      "version": "1.2.0"
    },
    {
      "id": "SCHEMA-ACTION-ASSIGNMENT",
      "path": "docs/market_demand_os_v7_2/schemas/action-assignment.schema.json",
      "sha256": "1666aa5125df6d3e831412d2930fc8f895cb0c7571911b9fb96cf0a4215ef5db",
      "version": "1.1.0"
    },
    {
      "id": "SCHEMA-ANALYSIS-DRAFT",
      "path": "docs/market_demand_os_v7_2/schemas/analysis-draft.schema.json",
      "sha256": "45f7faa21c1296f9e213e5e4ed23938301a41a3bd78ce3e1977641fa66998356",
      "version": "1.0.0"
    },
    {
      "id": "SCHEMA-BEACHHEAD-PROFILE",
      "path": "docs/market_demand_os_v7_2/schemas/beachhead-profile.schema.json",
      "sha256": "fd0f07a7ce212ddaa09ab367d9b09bc68c8e86e52c3a841b4f2cff14de91d05d",
      "version": "1.1.0"
    },
    {
      "id": "SCHEMA-CALL-EVIDENCE",
      "path": "docs/market_demand_os_v7_2/schemas/call-evidence.schema.json",
      "sha256": "e19d8fc1626c4fe6a314f6ff13f39deb182c049db3f8b7b0da01d029cda1d5e7",
      "version": "1.0.0"
    },
    {
      "id": "SCHEMA-CALL-INTERACTION",
      "path": "docs/market_demand_os_v7_2/schemas/call-interaction.schema.json",
      "sha256": "5fb29db41e8c09ac14e24956416e34521e36cc68531c6991ab82c025c001b7f9",
      "version": "1.0.0"
    },
    {
      "id": "SCHEMA-CLAIM",
      "path": "docs/market_demand_os_v7_2/schemas/claim.schema.json",
      "sha256": "71142baa1ff19635def98d1dc3c7f582d48f444d9db48c2938a4e97b6e25489a",
      "version": "1.1.0"
    },
    {
      "id": "SCHEMA-CONTRACT-MANIFEST",
      "path": "docs/market_demand_os_v7_2/schemas/contract-manifest.schema.json",
      "sha256": "801aca503dcbcec155483ba0b3983a9d049a076a77d6e0dcf79dfbe9d0b1fac5",
      "version": "1.2.0"
    },
    {
      "id": "SCHEMA-DEMAND-ASSESSMENT",
      "path": "docs/market_demand_os_v7_2/schemas/demand-assessment.schema.json",
      "sha256": "4e8f5abedd63fbb82dc00905a9497ad6a296b850233a1671308e12338f1dba4a",
      "version": "1.1.0"
    },
    {
      "id": "SCHEMA-DEMAND-UNIT",
      "path": "docs/market_demand_os_v7_2/schemas/demand-unit.schema.json",
      "sha256": "7461e34161d28c33f6395af9d4ebd70579470eb1090d64c31050135ec08c9dab",
      "version": "1.1.0"
    },
    {
      "id": "SCHEMA-ENTITY-RESOLUTION-DECISION",
      "path": "docs/market_demand_os_v7_2/schemas/entity-resolution-decision.schema.json",
      "sha256": "0e794efec9e01d8c21b1e54278fd827e733c2cac1bbbf38fef89ccc762e56ad2",
      "version": "1.1.0"
    },
    {
      "id": "SCHEMA-FULFILMENT-RECORD",
      "path": "docs/market_demand_os_v7_2/schemas/fulfilment-record.schema.json",
      "sha256": "71b46425b989b9ef24e63fc571b6f3bb8ac83188d1e892d3e34f6a7753b30a8e",
      "version": "1.1.0"
    },
    {
      "id": "SCHEMA-GOLD-ACCEPTANCE",
      "path": "docs/market_demand_os_v7_2/schemas/gold-acceptance.schema.json",
      "sha256": "04429a1bf90440a0ee9473bea06d3728127c875e828b65894924964b4c86a5e8",
      "version": "1.1.0"
    },
    {
      "id": "SCHEMA-OPERATOR-ADJUDICATION",
      "path": "docs/market_demand_os_v7_2/schemas/operator-adjudication.schema.json",
      "sha256": "53773feb45ec1cf48d79df1db1eece75e1bf5adaa47d80e7405ec05748557857",
      "version": "1.0.0"
    },
    {
      "id": "SCHEMA-OPERATOR-WORK-ITEM",
      "path": "docs/market_demand_os_v7_2/schemas/operator-work-item.schema.json",
      "sha256": "27b807f7eadca4b937789c4a4e7cd07e5741e9d6ee6ea014a9722cc8731255ee",
      "version": "1.0.0"
    },
    {
      "id": "SCHEMA-ORDER-RECORD",
      "path": "docs/market_demand_os_v7_2/schemas/order-record.schema.json",
      "sha256": "37cab4519d7ccc369287c0222822832b8c98b358ebc76c7ef5add72d35d54496",
      "version": "1.1.0"
    },
    {
      "id": "SCHEMA-OUTCOME-EVENT",
      "path": "docs/market_demand_os_v7_2/schemas/outcome-event.schema.json",
      "sha256": "b9a190af4726d3aa68f0996095d2b1c87df8833f7510d48665c86f356f523245",
      "version": "1.1.0"
    },
    {
      "id": "SCHEMA-PAYMENT-PROOF",
      "path": "docs/market_demand_os_v7_2/schemas/payment-proof.schema.json",
      "sha256": "84292c021cc9d83e32c35884a924b3ba7299ff8c7555f8977b82efe476e3c7fa",
      "version": "1.1.0"
    },
    {
      "id": "SCHEMA-PERMIT-DECISION",
      "path": "docs/market_demand_os_v7_2/schemas/permit-decision.schema.json",
      "sha256": "0e5002e2a0d6efe868c5ef38c4ea33c7744c9c3b636be6c4294bdd7c8fe5f825",
      "version": "1.1.0"
    },
    {
      "id": "SCHEMA-RATIFICATION-READINESS",